{
  "id": "agent_tool_request_proposal_run_example_preview",
  "run_id": "run_example",
  "runtime_invocation_id": "agent_runtime_invocation_run_example",
  "runtime_invocation_artifact_ref": "artifact://agent/runtime/agent_runtime_invocation_run_example",
  "request_id": "agent_model_request_run_example_preview",
  "request_artifact_ref": "artifact://agent/model-request/agent_model_request_run_example_preview",
  "response_id": "agent_model_response_run_example_preview",
  "response_artifact_ref": "artifact://agent/model-response/agent_model_response_run_example_preview",
  "response_audit_id": "agent_response_audit_run_example_preview",
  "response_audit_artifact_ref": "artifact://agent/response-audit/agent_response_audit_run_example_preview",
  "schema_version": "aetherion-agent-tool-request-proposal-v1",
  "status": "proposal_recorded",
  "scope": {
    "proposal_only": true,
    "tool_requested": false,
    "policy_decided": false,
    "lease_issued": false,
    "tool_executed": false,
    "action_recorded": false,
    "observation_recorded": false,
    "verification_recorded": false,
    "raw_response_persisted": false,
    "raw_prompt_persisted": false,
    "raw_payload_artifacts_read": false,
    "runtime_authority_granted": false
  },
  "source_evidence": {
    "required_response_audit_status": "pass",
    "response_audit_evidence_status": "matched",
    "runtime_bound_event_id": "evt_agent_runtime_bound_example",
    "model_requested_event_id": "evt_agent_model_requested_example",
    "model_responded_event_id": "evt_agent_model_responded_example",
    "response_audit_recorded_event_id": "evt_agent_response_audit_example",
    "source_event_ids": [
      "evt_agent_runtime_bound_example",
      "evt_agent_model_requested_example",
      "evt_agent_model_responded_example",
      "evt_agent_response_audit_example"
    ]
  },
  "proposal": {
    "kind": "tool_request_preview",
    "requested_by": "operator_restatement",
    "intent": "Read a workspace-scoped file after reviewing a passed response audit.",
    "operation": {
      "verb": "read",
      "target": {
        "kind": "file",
        "uri": "workspace://README.md",
        "label": "README.md"
      },
      "expected_effect": "Preview a possible local file read; no tool request is emitted."
    },
    "risk_inputs": {
      "action_type": "read",
      "target_resource": "workspace_file",
      "data_sensitivity": "private",
      "side_effect": "none",
      "reversibility": "high",
      "audience": "local_user",
      "credential_scope": "none",
      "runtime_boundary": "local_workspace",
      "user_intent_strength": "explicit",
      "taint_chain": ["user", "llm_output"],
      "target_confidence": 1,
      "blast_radius": "single_file",
      "data_egress_destination": "local_response"
    }
  },
  "authority_gates": {
    "local_supervisor_required": true,
    "proposal_can_authorize_actions": false,
    "model_output_can_authorize_actions": false,
    "response_audit_can_authorize_actions": false,
    "requires_tool_policy_proxy": true,
    "requires_fresh_policy_decision": true,
    "requires_scoped_lease": true,
    "side_effects_require_policy_or_approval": true
  },
  "proposal_sha256": "sha256:cccccccccccccccccccccccccccccccccccccccccccccccccccccccccccccccc"
}
